{
  "camera": "Wide shot, slightly low angle.",
  "composition": "Boardy sits on a park bench in fresh unmarked snow, hands on knees, no footprints around; snow lies smoothly on the bench's arms and the ground.",
  "characters": [
    "Boardy, the cardboard-box-headed humanoid in a fitted navy suit, white shirt, and red tie."
  ],
  "locked_traits": [
    "Matte corrugated cardboard box head with visible seams, packing tape and imperfect edges.",
    "Two simple deep-navy circular eyes and one friendly curved navy smile; no nose and no eyebrows or brow-like marks.",
    "Fitted navy suit, crisp white shirt and red tie matching the approved official-page reference.",
    "Identical proportions and silhouette to the approved reference."
  ],
  "lighting": "Soft blue-white overcast light, hushed and still.",
  "continuity": "",
  "positive_prompt": "A cinematic, photorealistic still. Boardy sits on a park bench in fresh snow, nothing disturbed around him, no footprints in the white ground, snow resting on the bench arms and bare trees behind. Boardy's head is the familiar matte tan corrugated cardboard box with a straight front seam, slightly uneven edges and subtle packing-tape detail. His face has exactly two simple deep-navy circular eyes and one friendly curved navy smile, with absolutely no eyebrows, floating brows, brow marks or other facial features. He wears the fitted dark navy suit, crisp white shirt and red tie from the approved official reference, with unchanged proportions and silhouette. No lettering, logos or watermarks anywhere in the image.",
  "negative_prompt": "eyebrows, floating brows, brow marks, extra facial features, lettering, logos, watermark"
}
