{
  "camera": "Medium close-up, slightly high angle looking into the box.",
  "composition": "The box head sits unsealed and empty on a table at center, its top flaps open wide; light pours through the open flaps into the hollow interior, which is empty; the front still shows the friendly face.",
  "characters": [
    "Boardy, the cardboard-box-headed humanoid in a fitted navy suit, white shirt, and red tie."
  ],
  "locked_traits": [
    "Matte corrugated cardboard box head with visible seams, packing tape and imperfect edges.",
    "Two simple deep-navy circular eyes and one friendly curved navy smile; no nose and no eyebrows or brow-like marks.",
    "Fitted navy suit, crisp white shirt and red tie matching the approved official-page reference.",
    "Identical proportions and silhouette to the approved reference."
  ],
  "lighting": "Strong soft light entering through the open flaps, glowing along the inner walls.",
  "continuity": "",
  "positive_prompt": "A cinematic, photorealistic still. Boardy's box head unsealed and empty on a plain table, its top flaps open and light streaming through them into the hollow interior, the outer front showing the two eyes and smile. The empty box head is the familiar matte tan corrugated cardboard box with a straight front seam and subtle packing-tape detail; its front shows exactly two simple deep-navy circular eyes and one friendly curved navy smile and absolutely no eyebrows or brow marks. No lettering, logos or watermarks anywhere.",
  "negative_prompt": "eyebrows, floating brows, brow marks, extra facial features, lettering, logos, watermark"
}
