{
  "camera": "Medium shot, eye level, side-front three-quarter view.",
  "composition": "Boardy seated at a pottery wheel at center throwing a pot, sleeves rolled up on both arms, clay-wet hands around the rising pot; face toward the viewer.",
  "characters": [
    "Boardy, the cardboard-box-headed humanoid in a fitted navy suit, white shirt, and red tie."
  ],
  "locked_traits": [
    "Matte corrugated cardboard box head with visible seams, packing tape and imperfect edges.",
    "Two simple deep-navy circular eyes and one friendly curved navy smile; no nose and no eyebrows or brow-like marks.",
    "Fitted navy suit, crisp white shirt and red tie matching the approved official-page reference.",
    "Identical proportions and silhouette to the approved reference."
  ],
  "lighting": "Soft north window light from camera left, matte clay tones.",
  "continuity": "",
  "positive_prompt": "A cinematic, photorealistic still. Boardy throws a clay pot on a pottery wheel, the sleeves of his suit and shirt rolled up to the elbows, wet grey clay on his hands, shelves of unfinished pots behind him. Boardy's head is the familiar matte tan corrugated cardboard box with a straight front seam, slightly uneven edges and subtle packing-tape detail. His face has exactly two simple deep-navy circular eyes and one friendly curved navy smile, with absolutely no eyebrows, floating brows, brow marks or other facial features. He wears the fitted dark navy suit, crisp white shirt and red tie from the approved official reference, with unchanged proportions and silhouette. No lettering, logos or watermarks anywhere in the image.",
  "negative_prompt": "eyebrows, floating brows, brow marks, extra facial features, lettering, logos, watermark"
}
