{
  "camera": "Medium shot at desk height, slightly low, 35mm look.",
  "composition": "Boardy leans in from the left toward a black landline phone at the right of the desk; face turned toward the phone, hand hovering short of the receiver, not touching it.",
  "characters": [
    "Boardy, the cardboard-box-headed humanoid in a fitted navy suit, white shirt, and red tie."
  ],
  "locked_traits": [
    "Matte corrugated cardboard box head with visible seams, packing tape and imperfect edges.",
    "Two simple deep-navy circular eyes and one friendly curved navy smile; no nose and no eyebrows or brow-like marks.",
    "Fitted navy suit, crisp white shirt and red tie matching the approved official-page reference.",
    "Identical proportions and silhouette to the approved reference."
  ],
  "lighting": "Dusk blue window light from camera right with one warm desk lamp, soft shadows that show the cardboard grain.",
  "continuity": "",
  "positive_prompt": "A cinematic, photorealistic still. Boardy sits at a wooden desk at dusk, leaning toward a ringing black landline phone mid-ring, one hand hovering above the receiver without lifting it, the curled cord and a small ceramic mug nearby. Boardy's head is the familiar matte tan corrugated cardboard box with a straight front seam, slightly uneven edges and subtle packing-tape detail. His face has exactly two simple deep-navy circular eyes and one friendly curved navy smile, with absolutely no eyebrows, floating brows, brow marks or other facial features. He wears the fitted dark navy suit, crisp white shirt and red tie from the approved official reference, with unchanged proportions and silhouette. No lettering, logos or watermarks anywhere in the image.",
  "negative_prompt": "eyebrows, floating brows, brow marks, extra facial features, lettering, logos, watermark"
}
