{
  "camera": "Medium close-up, slight high angle.",
  "composition": "Boardy holding a printed transcript in one hand and a yellow highlighter in the other, the highlighter just touching a line; the box tilted down toward it, face visible.",
  "characters": [
    "Boardy, the cardboard-box-headed humanoid in a fitted navy suit, white shirt, and red tie."
  ],
  "locked_traits": [
    "Matte corrugated cardboard box head with visible seams, packing tape and imperfect edges.",
    "Two simple deep-navy circular eyes and one friendly curved navy smile; no nose and no eyebrows or brow-like marks.",
    "Fitted navy suit, crisp white shirt and red tie matching the approved official-page reference.",
    "Identical proportions and silhouette to the approved reference."
  ],
  "lighting": "Soft task lamp from camera left, neutral fill.",
  "continuity": "",
  "positive_prompt": "A cinematic, photorealistic still. Boardy reads a printed transcript, a yellow highlighter in hand marking a line, the page showing only dense grey blurred lines of text without readable words. Boardy's head is the familiar matte tan corrugated cardboard box with a straight front seam, slightly uneven edges and subtle packing-tape detail. His face has exactly two simple deep-navy circular eyes and one friendly curved navy smile, with absolutely no eyebrows, floating brows, brow marks or other facial features. He wears the fitted dark navy suit, crisp white shirt and red tie from the approved official reference, with unchanged proportions and silhouette. No lettering, logos or watermarks anywhere in the image.",
  "negative_prompt": "eyebrows, floating brows, brow marks, extra facial features, lettering, logos, watermark, legible text"
}
