{
  "camera": "Close-up of a hand holding a phone, shallow depth of field.",
  "composition": "A human hand holds a smartphone vertically at the center; on its screen a tiny, warm Boardy stands in a small glowing scene, looking out toward the viewer.",
  "characters": [
    "Boardy, the cardboard-box-headed humanoid in a fitted navy suit, white shirt, and red tie.",
    "A person's hand holding the phone, no face visible."
  ],
  "locked_traits": [
    "Matte corrugated cardboard box head with visible seams, packing tape and imperfect edges.",
    "Two simple deep-navy circular eyes and one friendly curved navy smile; no nose and no eyebrows or brow-like marks.",
    "Fitted navy suit, crisp white shirt and red tie matching the approved official-page reference.",
    "Identical proportions and silhouette to the approved reference."
  ],
  "lighting": "The phone screen glows warm and soft, lighting the fingertips; the surroundings are dim and blurred.",
  "continuity": "",
  "positive_prompt": "A cinematic, photorealistic still. A person's hand holds up a smartphone whose screen shows a small, warm Boardy standing in a cozy glowing room, the screen contents rendered as a photograph-like tiny scene, the hand and phone bezel crisp in the foreground. Boardy's head is the familiar matte tan corrugated cardboard box with a straight front seam, slightly uneven edges and subtle packing-tape detail. His face has exactly two simple deep-navy circular eyes and one friendly curved navy smile, with absolutely no eyebrows, floating brows, brow marks or other facial features. He wears the fitted dark navy suit, crisp white shirt and red tie from the approved official reference, with unchanged proportions and silhouette. No lettering, logos or watermarks anywhere in the image.",
  "negative_prompt": "eyebrows, floating brows, brow marks, extra facial features, lettering, logos, watermark, interface text, icons, app buttons"
}
