{
  "camera": "Medium shot, slightly wide, eye level.",
  "composition": "Boardy at left in mid-speech, mouth-line smiling; a round blank speech-bubble shape drifts away to the right, upward and in the opposite direction from his face.",
  "characters": [
    "Boardy, the cardboard-box-headed humanoid in a fitted navy suit, white shirt, and red tie."
  ],
  "locked_traits": [
    "Matte corrugated cardboard box head with visible seams, packing tape and imperfect edges.",
    "Two simple deep-navy circular eyes and one friendly curved navy smile; no nose and no eyebrows or brow-like marks.",
    "Fitted navy suit, crisp white shirt and red tie matching the approved official-page reference.",
    "Identical proportions and silhouette to the approved reference."
  ],
  "lighting": "Soft even studio light on a pale background.",
  "continuity": "",
  "positive_prompt": "A cinematic, photorealistic still. Boardy speaks while a blank, empty speech bubble drifts away from him in the wrong direction, up and to the right, looking like a light translucent balloon. Boardy's head is the familiar matte tan corrugated cardboard box with a straight front seam, slightly uneven edges and subtle packing-tape detail. His face has exactly two simple deep-navy circular eyes and one friendly curved navy smile, with absolutely no eyebrows, floating brows, brow marks or other facial features. He wears the fitted dark navy suit, crisp white shirt and red tie from the approved official reference, with unchanged proportions and silhouette. No lettering, logos or watermarks anywhere in the image.",
  "negative_prompt": "eyebrows, floating brows, brow marks, extra facial features, lettering, logos, watermark, words in the speech bubble"
}
