{
  "camera": "Medium close shot, slightly low angle.",
  "composition": "Boardy at left holding a chalkboard eraser in hand beside a green chalkboard where a line of smudged chalk marks is half erased into a pale cloud, no legible letters.",
  "characters": [
    "Boardy, the cardboard-box-headed humanoid in a fitted navy suit, white shirt, and red tie."
  ],
  "locked_traits": [
    "Matte corrugated cardboard box head with visible seams, packing tape and imperfect edges.",
    "Two simple deep-navy circular eyes and one friendly curved navy smile; no nose and no eyebrows or brow-like marks.",
    "Fitted navy suit, crisp white shirt and red tie matching the approved official-page reference.",
    "Identical proportions and silhouette to the approved reference."
  ],
  "lighting": "Soft daylight from a classroom window at camera right.",
  "continuity": "",
  "positive_prompt": "A cinematic, photorealistic still. Boardy stands at a green chalkboard with an eraser still in his hand, a line of chalk marks half-wiped into a pale smear, chalk dust floating in the air. Boardy's head is the familiar matte tan corrugated cardboard box with a straight front seam, slightly uneven edges and subtle packing-tape detail. His face has exactly two simple deep-navy circular eyes and one friendly curved navy smile, with absolutely no eyebrows, floating brows, brow marks or other facial features. He wears the fitted dark navy suit, crisp white shirt and red tie from the approved official reference, with unchanged proportions and silhouette. No lettering, logos or watermarks anywhere in the image.",
  "negative_prompt": "eyebrows, floating brows, brow marks, extra facial features, lettering, logos, watermark, legible chalk text"
}
