{
  "camera": "Medium close-up, slightly low angle.",
  "composition": "Boardy at center with a welding mask flipping up on its hinge above the box head, revealing his face fully visible; sparks fading at the lower edge.",
  "characters": [
    "Boardy, the cardboard-box-headed humanoid in a fitted navy suit, white shirt, and red tie."
  ],
  "locked_traits": [
    "Matte corrugated cardboard box head with visible seams, packing tape and imperfect edges.",
    "Two simple deep-navy circular eyes and one friendly curved navy smile; no nose and no eyebrows or brow-like marks.",
    "Fitted navy suit, crisp white shirt and red tie matching the approved official-page reference.",
    "Identical proportions and silhouette to the approved reference."
  ],
  "lighting": "Bright welding glow at lower frame fading, with soft workshop fill.",
  "continuity": "",
  "positive_prompt": "A cinematic, photorealistic still. Boardy flips up a welding mask to reveal his box head, the mask hinged above his face, orange sparks fading in the dark workshop behind. The face revealed under the flipped-up mask is the familiar matte tan corrugated cardboard box with exactly two simple deep-navy circular eyes and one friendly curved navy smile and absolutely no eyebrows or brow marks. He wears the fitted dark navy suit, crisp white shirt and red tie from the approved reference. No lettering, logos or watermarks anywhere.",
  "negative_prompt": "eyebrows, floating brows, brow marks, extra facial features, lettering, logos, watermark"
}
